{
  "schema_version": "1.0",
  "run_id": "fix-init-unknown-route-001",
  "status": "DONE",
  "intent": "BUG_FIX",
  "risk": "LOW",
  "current_node": "KNOWLEDGE_PROMOTION",
  "next_role": "knowledge-keeper",
  "phase_dir": ".harness/phases/fix-init-unknown-route-001",
  "required_nodes": [
    "INTAKE",
    "DEVELOPMENT",
    "COMPILE",
    "UNIT_TEST",
    "EVIDENCE_CAPTURE",
    "ACCEPTANCE_REPORT",
    "KNOWLEDGE_PROMOTION"
  ],
  "completed_nodes": [
    "INTAKE",
    "DEVELOPMENT",
    "COMPILE",
    "UNIT_TEST",
    "EVIDENCE_CAPTURE",
    "ACCEPTANCE_REPORT",
    "KNOWLEDGE_PROMOTION"
  ],
  "blocked_by": [],
  "artifacts": {
    "INTAKE": "00-intake.md",
    "DEVELOPMENT": "11-development.md",
    "COMPILE": "12-compile.md",
    "UNIT_TEST": "13-unit-test.md",
    "EVIDENCE_CAPTURE": "15-evidence.json",
    "ACCEPTANCE_REPORT": "18-acceptance-report.md",
    "KNOWLEDGE_PROMOTION": "19-knowledge-promotion.md"
  },
  "gates": {
    "G1_REQUIREMENTS": "NOT_REQUIRED",
    "G2_DESIGN": "NOT_REQUIRED",
    "G3_COMPILE": "PASS",
    "G4_UNIT_TEST": "PASS",
    "G5_ATDD": "NOT_REQUIRED",
    "G6_EVIDENCE": "PASS",
    "G7_PRERELEASE": "NOT_REQUIRED",
    "G8_ACCEPTANCE": "PASS"
  },
  "retry_counts": {},
  "last_updated": "2026-07-22T16:15:00+00:00",
  "notes": "Fixed init-time UNKNOWN/UNKNOWN route validation regression."
}
