{
  "schema_version": "1.0",
  "run_id": "release-improve-quality-001",
  "status": "DEPLOYING",
  "intent": "DEPLOYMENT",
  "risk": "MEDIUM",
  "current_node": "PRERELEASE_DEPLOYMENT",
  "next_role": "deployer",
  "phase_dir": ".harness/phases/release-improve-quality-001",
  "required_nodes": [
    "INTAKE",
    "PRE_MORTEM",
    "PRERELEASE_DEPLOYMENT",
    "INTERFACE_TEST",
    "EVIDENCE_CAPTURE",
    "ACCEPTANCE_REPORT",
    "KNOWLEDGE_PROMOTION"
  ],
  "completed_nodes": [
    "INTAKE",
    "PRE_MORTEM"
  ],
  "blocked_by": [],
  "artifacts": {
    "INTAKE": "00-intake.md",
    "PRE_MORTEM": "05-pre-mortem.md"
  },
  "gates": {
    "G1_REQUIREMENTS": "NOT_REQUIRED",
    "G2_DESIGN": "PASS",
    "G3_COMPILE": "NOT_REQUIRED",
    "G4_UNIT_TEST": "NOT_REQUIRED",
    "G5_ATDD": "NOT_REQUIRED",
    "G6_EVIDENCE": "NOT_RUN",
    "G7_PRERELEASE": "NOT_RUN",
    "G8_ACCEPTANCE": "NOT_RUN"
  },
  "retry_counts": {},
  "last_updated": "2026-07-22T22:18:00+08:00",
  "notes": "INTAKE and PRE_MORTEM completed; next node is PRERELEASE_DEPLOYMENT."
}
