{
  "schema_version": "1.0",
  "run_id": "release-improve-quality-001",
  "status": "DONE",
  "intent": "DEPLOYMENT",
  "risk": "MEDIUM",
  "current_node": "KNOWLEDGE_PROMOTION",
  "next_role": "knowledge-keeper",
  "phase_dir": ".harness/phases/release-improve-quality-001",
  "required_nodes": [
    "INTAKE",
    "PRE_MORTEM",
    "PRERELEASE_DEPLOYMENT",
    "INTERFACE_TEST",
    "EVIDENCE_CAPTURE",
    "ACCEPTANCE_REPORT",
    "KNOWLEDGE_PROMOTION"
  ],
  "completed_nodes": [
    "INTAKE",
    "PRE_MORTEM",
    "PRERELEASE_DEPLOYMENT",
    "INTERFACE_TEST",
    "EVIDENCE_CAPTURE",
    "ACCEPTANCE_REPORT",
    "KNOWLEDGE_PROMOTION"
  ],
  "blocked_by": [],
  "artifacts": {
    "INTAKE": "00-intake.md",
    "PRE_MORTEM": "05-pre-mortem.md",
    "PRERELEASE_DEPLOYMENT": "16-prerelease-deployment.md",
    "INTERFACE_TEST": "17-interface-test.md",
    "EVIDENCE_CAPTURE": "15-evidence.json",
    "ACCEPTANCE_REPORT": "18-acceptance-report.md",
    "KNOWLEDGE_PROMOTION": "19-knowledge-promotion.md"
  },
  "gates": {
    "G1_REQUIREMENTS": "NOT_REQUIRED",
    "G2_DESIGN": "PASS",
    "G3_COMPILE": "NOT_REQUIRED",
    "G4_UNIT_TEST": "NOT_REQUIRED",
    "G5_ATDD": "NOT_REQUIRED",
    "G6_EVIDENCE": "PASS",
    "G7_PRERELEASE": "PASS",
    "G8_ACCEPTANCE": "PASS"
  },
  "retry_counts": {},
  "last_updated": "2026-07-22T22:44:00+08:00",
  "notes": "v0.1.1 release completed: main and tag pushed, GitHub Release created, Windows CLI asset uploaded."
}
